北京市2009年度土地供应计划,2009年3月30日 0:00,北京市 > 北京市市辖区 > 北京市本级,北京市本级,北京市市辖区,北京市2009年度土地供应计划为深入贯彻党的十七届三中全会精神，落实科学发展观，促进土地节约集约利用，建设“人文北京、科技北京、绿色北京” ，促进首都经济平稳较快增长，依据《北京市人民政府关于印发北京市2007至2010年土地供应中期计划的通知》（京政发［2007］20号），结合本市2009年的社会经济发展形势，制定本计划。一、计划指标（一）总量2009年土地供应总量在5700公顷左右，其中新增建设用地严格控制在3300公顷以内，鼓励和引导利用存量建设用地2400公顷左右。（二）用途结构在2009年土地供应总量中，基础设施用地2800公顷；工业仓储用地800公顷；其他产业用地200公顷；科技、教育、文化、卫生、体育和行政办公用地400公顷；住宅用地1300公顷，其中：廉租住房及经济适用住房类用地200公顷，限价商品房及政策性租赁房用地400公顷，其他商品房用地700公顷；商服用地200公顷。（三）空间布局首都功能核心区和生态涵养区的土地供应量不高于土地供应总量的25％，城市功能拓展区和城市发展新区的土地供应量不低于土地供应总量的75％。二、土地供应导向（一）加大基础设施和以改善民生为重点的公共服务、环境建设的土地供应，提升城市运行和服务水平。保证轨道交通（四号线、九号线、十号线二期、亦庄线、八号线、六号线、大兴线等）、高速公路（西六环、京开线、京包高速等）、京石铁路客运专线、城市道路等关键性基础设施项目的土地供应，增强基础设施承载能力；保证南水北调工程、市政、能源供应等基础设施项目的土地供应，增强城市发展的保障能力；支持环卫、城市绿化等项目用地供应，提高城市环境质量。大力支持以改善民生为重点的教育、科技、文化、体育、卫生等公共服务和环境建设的土地供应，构建覆盖城乡、功能完善的综合公共服务体系，积极支持沙河和良乡高教集中建设园区建设。（二）调整和优化住宅用地供应结构，加大政府土地储备力度，确保保障性住房和限价商品房的供应，促进房地产市场的健康发展。优化住宅用地供应结构，促进建立“低端需求有保障，中端需求有支撑，高端需求有市场”的住宅供应模式。确保廉租住房20万平方米，经济适用住房160万平方米，限价房650万平方米，政策性租赁房20万平方米开工建设的土地供应，合理把握商品房用地供应时序和空间布局，促进房地产市场的健康发展。加大政府土地收购储备力度，增强政府住房保障和调控市场的能力。（三）优先保证高端、高效、高辐射力的优势产业的用地供应，支持重点产业集聚区和功能区的发展。重点保障朝阳金盏金融服务区、海淀稻香湖金融服务区、通州商务区等金融后台服务区的土地供应，全面提升本市金融后台服务能力，构建“一主一副三新四后台”的首都金融发展布局；鼓励盘活存量用地，用于文化创意产业发展，大力支持二十一个文化创意产业集聚区建设的土地供应，支持物流服务、商务服务及教育培训等生产性服务业的土地供应。重点支持三个国家级开发区、六大高端产业功能区、十六个市级开发区的土地供应，以高技术产业带动现代制造业发展，促进产业结构的升级和优化。（四）支持重点新城、南城、西南地区和新农村建设的土地，促进城乡和区域协调发展。土地供应进一步由中心城向新城倾斜，优先保证重大区域性基础设施建设和重大产业项目的土地供应，支持通州、顺义、亦庄等新城的建设；重点支持城市南部地区基础设施和公用设施的土地供应，提高南城的服务和支撑能力，促进南城和西南地区的发展和建设；加强重点镇和农村基础设施和公共服务设施的土地供应，促进城乡统筹发展。三、计划的执行（一）计划指标本着“全市统筹、区域协调、分类指导、保障重点”的原则，2009年基础设施计划和科教文卫体及行政办公用地供应计划指标3268公顷，实行全市统筹安排；住宅用地、商服用地和工业仓储及其他产业发展用地供应计划指标2432公顷分解到区县，并作为区县实施年度计划考核的依据。（二）年度计划实施区县政府和市政府相关部门继续按照《北京市人民政府关于印发北京市2007至2010年土地供应中期计划的通知》（京政发[2007]20号）的要求，采取有效措施，切实做好2009年度土地供应计划实施工作。一是落实土地供应计划地块公布制度。土地供应计划公布实施后，区县政府应依据计划确定的区县指标和具体项目进度，分季度落实和提出拟供应的住宅、商服、工业仓储和其他产业的地块（或项目），并分别于4月15日、7月15日和10月15日前，报市国土局、市发展改革委、市规划委汇总后，向社会公布。二是加强计划实施过程的沟通和协调，进一步完善市政府相关部门和区县政府共同实施计划的联动机制。市国土局、市发展改革委和市规划委等部门，主动服务，定期协调解决计划实施中存在的问题，对列入计划的项目加快审批，支持帮助区县政府和市有关行业主管部门，推进计划实施。区县政府和市有关行业主管部门要充分发挥实施土地供应计划的主体作用，加强规划设计、征地拆迁等前期工作协调，及时主动地与市国土局、市发展改革委和市规划委等部门沟通，共同研究解决计划实施过程中遇到的困难和问题，确保计划的实施。三是加强计划的动态跟踪管理和通报。市国土局、市发展改革委和市规划委及时总结计划执行情况，定期向社会通报计划执行情况，对因特殊原因影响供应计划安排的，应及时会同相关部门和相关区县政府做好计划调整工作。四是建立计划实施的考核机制。市国土局、市发展改革委和市规划委对区县土地供应计划的组织、工作绩效和计划实施效果进行综合评价，结合区县本年度内耕地保护目标责任的落实情况和违法违规用地情况，形成综合意见上报市政府并纳入市政府考核区县工作的指标内容。对计划执行好的区县在下一年度的土地储备计划的新增指标上给予倾斜，对于计划执行不好的区县相应扣减指标。四、本计划自颁布之日起执行。,http://www.landchina.com/DesktopModule/BizframeExtendMdl/workList/bulWorkView.aspx?wmguid=6506735a-142d-4bde-9674-121656045ed1&recorderguid=e7a8ea90-ebec-4328-bc06-9a21fac87efc&sitePath=,2009,5700公顷,3300公顷以内,2400公顷,200公顷,,1300公顷,,,,,,,,,,,,,a4a691be94334dddc5b818aa96bcebee,2020-04-22 18:13:23
二○一一年津南区第一批工业项目（含部分公共设施用地）供应计划公示,2011年1月18日 16:10,天津市 > 天津市市辖区 > 津南区,津南区,天津市市辖区,二○一一年津南区第一批工业项目（含部分公共设施用地）供应计划公示按照国土资源部监察部《关于落实工业用地招标拍卖挂牌出让制度有关问题的通知》、国土资源部39号令和《天津市工业用地招标拍卖挂牌出让试行办法》的要求，我局制定了二○一一年津南区第一批工业项目（含部分公共设施用地）供应计划，业经天津市津南区人民政府批准（津南政函[2011]9号），现予以发布。附表：2011年津南区第一批工业项目供应计划（含部分公共设施用地）津南区国土资源分局二一一年一月十八日,http://www.landchina.com/DesktopModule/BizframeExtendMdl/workList/bulWorkView.aspx?wmguid=6506735a-142d-4bde-9674-121656045ed1&recorderguid=a84ffa80-2f00-4173-a61d-72363f7ae6ff&sitePath=,,,,,,,,,,,,,,,,,,,,eda4ea5923a6207fb25d8c978d4936cf,2020-04-22 18:13:40
2011年津南区第一批经营性房地产开发用地供应计划公告,2010年12月22日 9:27,天津市 > 天津市市辖区 > 津南区,津南区,天津市市辖区,2011年津南区第一批经营性房地产开发用地供应计划公告按照国土资源部监察部《关于落实工业用地招标拍卖挂牌出让制度有关问题的通知》、国土资源部39号令和《天津市工业用地招标拍卖挂牌出让试行办法》的要求，我局制定了2011年津南区第一批经营性房地产开发用地供应计划，业经天津市津南区人民政府批准（津南政函[2010]406号），现予以发布。附表：2011年津南区第一批经营性房地产开发用地供应计划津南区国土资源分局二一年十二月二十二日,http://www.landchina.com/DesktopModule/BizframeExtendMdl/workList/bulWorkView.aspx?wmguid=6506735a-142d-4bde-9674-121656045ed1&recorderguid=67d9490d-c26b-4653-b4b3-09dd750949a9&sitePath=,,,,,,,,,,,,,,,,,,,,d3d8a18aa08944006a73689389c79d22,2020-04-22 18:13:46
二一年津南区第四批出让计划公告,2010年9月25日 14:01,天津市 > 天津市市辖区 > 津南区,津南区,天津市市辖区,二一年津南区第四批出让计划公告按照国土资源部监察部《关于落实工业用地招标拍卖挂牌出让制度有关问题的通知》、国土资源部39号令和《天津市工业用地招标拍卖挂牌出让试行办法》的要求，我局制定了2010年津南区第四批出让计划，业经天津市津南区人民政府批准（津南政函[2010]280号），现予以发布。附表：2010年津南区第四批出让计划津南区国土资源分局二一年九月二十五日,http://www.landchina.com/DesktopModule/BizframeExtendMdl/workList/bulWorkView.aspx?wmguid=6506735a-142d-4bde-9674-121656045ed1&recorderguid=2b6d817a-8a26-467d-8558-6ae2d0c7c597&sitePath=,,,,,,,,,,,,,,,,,,,,f69288ade11558168568ace51b454bcd,2020-04-22 18:13:54
二一年津南区第三批出让计划公告,2010年6月19日 8:51,天津市 > 天津市市辖区 > 津南区,津南区,天津市市辖区,二一年津南区第三批出让计划公告按照国土资源部监察部《关于落实工业用地招标拍卖挂牌出让制度有关问题的通知》、国土资源部39号令和《天津市工业用地招标拍卖挂牌出让试行办法》的要求，我局制定了2010年津南区第三批出让计划，业经天津市津南区人民政府批准（津南政函[2010]154号），现予以发布。附表：2010年津南区第三批出让计划津南区国土资源分局二一年六月十九日,http://www.landchina.com/DesktopModule/BizframeExtendMdl/workList/bulWorkView.aspx?wmguid=6506735a-142d-4bde-9674-121656045ed1&recorderguid=1f9a0d81-07c7-4bcc-b82b-321ebdd8a243&sitePath=,,,,,,,,,,,,,,,,,,,,0292eea9c4420a0dd8c0c6b9fc36f31e,2020-04-22 18:13:59
天津市中心城区2010年拟出让地块简介,2010年2月4日 17:17,天津市 > 天津市市辖区 > 和平区,和平区,天津市市辖区,为进一步促进天津市房地产市场的健康发展，满足广大开发企业的置地需求，结合2010年天津市土地供应计划及城市规划成果，天津市国土资源和房屋管理局选择了中心城区23宗条件成熟、配套完善、市场广阔、潜力突出的拟出让地块进行集中发布，用地总面积323公顷，建筑总规模721万平方米。其中，居住用地249公顷，建筑规模509万平方米，分占推介总量的77%、70%；商服用地74公顷，建筑规模212万平方米，分占推介总量的23%、30%。各地块具体情况如下：（最终的出让条件以天津土地交易中心发布的出让公告为准）南开区：水上公园北道地块该地块位于南开区水上公园北道以南、卫津南路以西，土地用途商业金融业，规划用地面积9.8公顷，容积率3.5。河西区：黑牛城道地块该地块位于河西区黑牛城道南侧，土地用途商业金融业，规划用地面积11.0公顷，容积率2.5。洞庭路地块该地块位于河西区洞庭路东侧，土地用途居住、商业，居住用地面积22.0公顷（按20%比例配建限价商品房），容积率2.2；商业用地面积4.0公顷，容积率2.5。宾水道地块该地块位于河西区宾水道以南，土地用途居住，规划用地面积2.55公顷，容积率2.0。河东区：新开路地块该地块位于河东区新开路北侧，土地用途居住，规划用地面积3.17公顷，容积率3.0。万新庄地块该地块位于河东区顺达路东侧、津滨大道北侧，土地用途居住、商业，居住用地面积16.0公顷（按20%比例配建限价商品房），容积率2.5；商业用地面积11.5公顷，容积率3.0。六纬路地块该地块位于河东区六纬路西侧，土地用途商业金融业，规划用地面积8.7公顷，容积率2.5。红星路地块该地块位于河东区靖江路西侧、晨阳道南侧，土地用途居住、商业，居住用地面积4.0公顷（按20%比例配建限价商品房），容积率2.0；商业用地面积1.0公顷，容积率2.2。河北区：金钟河大街地块该地块位于河北区金钟河大街北侧，土地用途居住、商业，居住用地面积18.54公顷，容积率2.6；商业用地面积9.13公顷，容积率3.5。天泰路地块该地块位于河北区子牙河以北、天泰路以西，土地用途居住、商业，居住用地面积5.0公顷（按20%比例配建限价商品房），容积率2.5；商业用地面积7.5公顷，容积率2.8。杜鹃道地块该地块位于河北区杜鹃道北侧，土地用途居住（限价商品房），规划用地面积3.04公顷，容积率2.3。红桥区：光荣道北侧地块该地块位于红桥区光荣道以北、本溪路以东，土地用途居住、商业金融业，居住用地面积6.37公顷（按20%比例配建限价商品房），容积率2.0；商业金融业用地面积3.69公顷，容积率3.4。北辰区：光荣道地块该地块位于北辰区光荣道北侧，土地用途居住，规划用地面积1.3公顷，容积率2.0。西青区：昌凌路东侧地块该地块位于西青区卫津南路西侧、昌凌路东侧，土地用途居住，规划用地面积6.5公顷（按40%比例配建限价商品房），容积率2.5。昌凌路西侧地块该地块位于西青区昌凌路西侧，土地用途居住，规划用地面积5.12公顷，容积率2.0。新津杨公路北侧地块该地块位于西青区新津杨公路北侧，土地用途居住，规划用地面积5.9公顷（按25%比例配建限价商品房），容积率1.2。新津杨公路南侧地块该地块位于西青区新津杨公路南侧，土地用途居住，规划用地面积11.0公顷（按25%比例配建限价商品房），容积率1.2。卫津南路地块该地块位于西青区卫津南路西侧，土地用途居住，规划用地面积13.0公顷（按20%比例配建限价商品房），容积率2.2。赛达路地块该地块位于西青区赛达路西侧，土地用途居住，规划用地面积54.0公顷，容积率1.8。阜锦道地块该地块位于西青区阜锦道南侧，土地用途居住、商业，居住用地面积42.0公顷（按25%比例配建限价商品房），容积率2.0；商业用地面积8.0公顷，容积率2.0。东丽区：成林道地块该地块位于东丽区成林道北侧，土地用途居住，规划用地面积12公顷（按25%比例配建限价商品房），容积率2.0。万山道地块该地块位于东丽区万山道北侧，土地用途居住（限价商品房），规划用地面积8.5公顷，容积率2.0。俞蒙道地块该地块位于东丽区俞蒙道北侧，土地用途居住（限价商品房），规划用地面积8.65公顷，容积率2.0。2010年1月,http://www.landchina.com/DesktopModule/BizframeExtendMdl/workList/bulWorkView.aspx?wmguid=6506735a-142d-4bde-9674-121656045ed1&recorderguid=5ade4e40-b2a8-4e8c-9bed-7498f54b716e&sitePath=,,,,,74公顷,,,,,,,,,,,,,,,b229836bfca870e0e804a5cecea587cc,2020-04-22 18:14:04
二一年津南区第二批出让计划公告,2010年1月26日 8:44,天津市 > 天津市市辖区 > 津南区,津南区,天津市市辖区,二一年津南区第二批出让计划公告按照国土资源部监察部《关于落实工业用地招标拍卖挂牌出让制度有关问题的通知》、国土资源部39号令和《天津市工业用地招标拍卖挂牌出让试行办法》的要求，我局制定了2010年津南区第二批出让计划，业经天津市津南区人民政府批准（津南政函[2010]22号），现予以发布。附表：2010年津南区第二批出让计划津南区国土资源分局二一年一月二十六日,http://www.landchina.com/DesktopModule/BizframeExtendMdl/workList/bulWorkView.aspx?wmguid=6506735a-142d-4bde-9674-121656045ed1&recorderguid=7c10f74f-47db-4ae6-ac8e-0018e20a08e8&sitePath=,,,,,,,,,,,,,,,,,,,,d38ea1dfd9f2216caba1f0d410863000,2020-04-22 18:14:12
二一年津南区第一批出让计划公告,2010年1月11日 16:34,天津市 > 天津市市辖区 > 津南区,津南区,天津市市辖区,二一年津南区第一批出让计划公告按照国土资源部监察部《关于落实工业用地招标拍卖挂牌出让制度有关问题的通知》、国土资源部39号令和《天津市工业用地招标拍卖挂牌出让试行办法》的要求，我局制定了2010年津南区第一批出让计划，业经天津市津南区人民政府批准（津南政函[2010]11号），现予以发布。附表：2010年津南区第一批出让计划津南区国土资源分局二一年一月十一日,http://www.landchina.com/DesktopModule/BizframeExtendMdl/workList/bulWorkView.aspx?wmguid=6506735a-142d-4bde-9674-121656045ed1&recorderguid=63e42de1-fd38-4c88-b4bf-b6dc807c19f5&sitePath=,,,,,,,,,,,,,,,,,,,,6d5bb31cc9d378cbaa3d80b00e79d1d8,2020-04-22 18:14:20
二九年津南区第五批出让计划公告,2009年12月2日 13:17,天津市 > 天津市市辖区 > 津南区,津南区,天津市市辖区,二九年津南区第五批出让计划公告按照国土资源部监察部《关于落实工业用地招标拍卖挂牌出让制度有关问题的通知》、国土资源部39号令和《天津市工业用地招标拍卖挂牌出让试行办法》的要求，我局制定了2009年津南区第五批出让计划，业经天津市津南区人民政府批准（津南政函[2009]423号），现予以发布。附表：2009年津南区第五批出让计划津南区国土资源分局二九年十二月二日,http://www.landchina.com/DesktopModule/BizframeExtendMdl/workList/bulWorkView.aspx?wmguid=6506735a-142d-4bde-9674-121656045ed1&recorderguid=f877b3b6-e03c-4fac-9f9d-7e9f6e0525c4C&sitePath=,,,,,,,,,,,,,,,,,,,,49c507a2c82560081a0f25584773bb45,2020-04-22 18:14:29
二九年津南区第四批出让计划公告,2009年9月25日 14:40,天津市 > 天津市市辖区 > 津南区,津南区,天津市市辖区,二九年津南区第四批出让计划公告按照国土资源部监察部《关于落实工业用地招标拍卖挂牌出让制度有关问题的通知》、国土资源部39号令和《天津市工业用地招标拍卖挂牌出让试行办法》的要求，我局制定了2009年津南区第四批出让计划，业经天津市津南区人民政府批准（津南政函[2009]342号），现予以发布。附表：2009年津南区第四批出让计划天津市国土资源和房屋管理局津南区国土资源分局二九年九月二十五日,http://www.landchina.com/DesktopModule/BizframeExtendMdl/workList/bulWorkView.aspx?wmguid=6506735a-142d-4bde-9674-121656045ed1&recorderguid=b33b72c0-c8c7-454d-af76-8705c21e1be1&sitePath=,,,,,,,,,,,,,,,,,,,,983ab0de5aee8e76bd79c388d8ec9720,2020-04-22 18:14:35
二九年津南区第三批出让计划公告,2009年7月31日 0:00,天津市 > 天津市市辖区 > 津南区,津南区,天津市市辖区,二九年津南区第三批出让计划公告按照国土资源部监察部《关于落实工业用地招标拍卖挂牌出让制度有关问题的通知》、国土资源部39号令和《天津市工业用地招标拍卖挂牌出让试行办法》的要求，我局制定了2009年津南区第三批出让计划，业经天津市津南区人民政府批准（津南政函[2009]250号），现予以发布。天津市国土资源和房屋管理局津南区国土资源分局二九年七月三十一日,http://www.landchina.com/DesktopModule/BizframeExtendMdl/workList/bulWorkView.aspx?wmguid=6506735a-142d-4bde-9674-121656045ed1&recorderguid=d727c6fb-a235-432b-bbe3-af0bc108c393&sitePath=,,,,,,,,,,,,,,,,,,,,c509f42df683e39455f065fc2bb463d3,2020-04-22 18:14:46
二九年津南区第二批出让计划公告,2009年7月15日 0:00,天津市 > 天津市市辖区 > 津南区,津南区,天津市市辖区,二九年津南区第二批出让计划公告按照国土资源部监察部《关于落实工业用地招标拍卖挂牌出让制度有关问题的通知》、国土资源部39号令和《天津市工业用地招标拍卖挂牌出让试行办法》的要求，我局制定了2009年津南区第二批出让计划，业经天津市津南区人民政府批准（津南政函[2009]212号），现予以发布。附：2009年津南区第二批出让计划联系单位： 天津市国土资源和房屋管理局津南区国土资源分局土地市场科联系人： 冯女士王先生联系电话：（022） 88510003天津市国土资源和房屋管理局津南区国土资源分局二九年七月十五日,http://www.landchina.com/DesktopModule/BizframeExtendMdl/workList/bulWorkView.aspx?wmguid=6506735a-142d-4bde-9674-121656045ed1&recorderguid=c073e61e-22e8-4982-905f-8843ae0f06b1&sitePath=,,,,,,,,,,,,,,,,,,,,95250018a6c86d7a8c7fc6110da35f15,2020-04-22 18:14:53
二九年津南区第一批出让计划公告,2009年4月17日 0:00,天津市 > 天津市市辖区 > 津南区,津南区,天津市市辖区,二九年津南区第一批出让计划公告按照国土资源部监察部《关于落实工业用地招标拍卖挂牌出让制度有关问题的通知》、国土资源部39号令和《天津市工业用地招标拍卖挂牌出让试行办法》的要求，我局制定了2009年津南区第一批出让计划，业经天津市津南区人民政府批准（津南政函[2009]94号），现予以发布。附：2009年津南区第一批出让计划联系单位： 天津市国土资源和房屋管理局津南区国土资源分局市场科联系人： 冯女士王先生联系电话：（022） 88510003天津市国土资源和房屋管理局津南区国土资源分局二九年四月十七日,http://www.landchina.com/DesktopModule/BizframeExtendMdl/workList/bulWorkView.aspx?wmguid=6506735a-142d-4bde-9674-121656045ed1&recorderguid=7a4112b2-0f6b-465b-939a-0be98f030758&sitePath=,,,,,,,,,,,,,,,,,,,,97f8d6dd637803f2720338a4f63940db,2020-04-22 18:15:01
二八年津南区第五批出让计划公告,2008年12月12日 9:04,天津市 > 天津市市辖区 > 津南区,津南区,天津市市辖区,二八年津南区第五批出让计划公告按照国土资源部监察部《关于落实工业用地招标拍卖挂牌出让制度有关问题的通知》和《天津市工业用地招标拍卖挂牌出让试行办法》的要求，我局制定了2008年津南区第五批出让计划，经天津市津南区人民政府批准（津南政函[2008]302号），现予以发布。附：2008年津南区第五批出让计划联系单位： 天津市国土资源和房屋管理局津南区国土资源分局市场科联系人： 冯女士王先生联系电话：（022） 88510003天津市国土资源和房屋管理局津南区国土资源分局二八年十二月十二日,http://www.landchina.com/DesktopModule/BizframeExtendMdl/workList/bulWorkView.aspx?wmguid=6506735a-142d-4bde-9674-121656045ed1&recorderguid=3069181&sitePath=,,,,,,,,,,,,,,,,,,,,a39b618da3df922cd14d2590fdb19a4f,2020-04-22 18:15:10
二八年津南区第四批出让计划公告,2008年9月18日 8:56,天津市 > 天津市市辖区 > 津南区,津南区,天津市市辖区,二八年津南区第四批出让计划公告按照国土资源部监察部《关于落实工业用地招标拍卖挂牌出让制度有关问题的通知》和《天津市工业用地招标拍卖挂牌出让试行办法》的要求，我局制定了2008年津南区第四批出让计划，经天津市津南区人民政府批准（津南政函[2008]210号），现予以发布。附：2008年津南区第四批出让计划联系单位： 天津市国土资源和房屋管理局津南区国土资源分局市场科联系人： 冯女士王先生联系电话：（022） 88510003天津市国土资源和房屋管理局津南区国土资源分局二八年九月十八日,http://www.landchina.com/DesktopModule/BizframeExtendMdl/workList/bulWorkView.aspx?wmguid=6506735a-142d-4bde-9674-121656045ed1&recorderguid=3060160&sitePath=,,,,,,,,,,,,,,,,,,,,c834819e46738b128c840774170e8a7c,2020-04-22 18:15:19
